{
  "schema_version": "0.1",
  "reference_part": "bracket_b01",
  "shared_systems": {
    "cooling_line_1": {
      "name_ko": "냉각라인1",
      "kind": "cooling_line"
    },
    "power_zone_a": {
      "name_ko": "전원반 A",
      "kind": "power_zone"
    }
  },
  "parts": [
    {
      "id": "bracket_b01",
      "name_ko": "브래킷 B-01 (L형, 3 mm 연강)",
      "material": "mild steel",
      "thickness_mm": 3,
      "blank_mm": {
        "l": 200,
        "w": 120
      },
      "cut_length_m": 0.69,
      "pierces": 3,
      "holes": 2,
      "hole_depth_mm": 3,
      "bends": 2,
      "length_m": 0.2,
      "seam_length_m": 0.06,
      "seams": 1,
      "parts_per_box": 50,
      "provenance": {
        "confidence": "assumed",
        "note": "가상의 대표 부품. 외곽 200×120 mm(둘레 0.64 m) + Ø8 구멍 2개(둘레 0.05 m) = 절단 길이 0.69 m. 실제 부품 도면으로 교체 필요."
      }
    }
  ],
  "factory": {
    "id": "k_factory_demo",
    "name": "K-Factory 데모 공장",
    "line_id": "line_a",
    "line_name_ko": "라인 A",
    "industry": "자동차 부품(브래킷류) 가공·용접 라인 (가정)",
    "description": "업종과 물량은 설계 변수이며 실제 공장 데이터가 아니다. 핵심 설비 7종의 치수는 제조사 제원을 참조한다(출처 표시 참고).",
    "building_m": {
      "w": 58,
      "d": 18
    },
    "utility_strip_depth_m": 3.4
  },
  "assumptions": {
    "annual_volume_units": 500000,
    "working_days_per_year": 250,
    "shifts_per_day": 2,
    "productive_hours_per_shift": 7.5,
    "oee": 0.85,
    "max_utilization": 0.85,
    "notes": "모두 가정. 연 8만 개 이상이라는 워털루대 사례(waterloo)만 공개 자료로 확인한 하한 규모이다. 사이클 타임은 제조사가 공개하지 않아 대표 부품(parts)과 공정 변수(cycle_model)로 계산하며, 변수 대부분은 가정이다."
  },
  "sources": [
    {
      "id": "trumpf_3030",
      "title": "TRUMPF TruLaser 3030 fiber — product page, technical data table",
      "url": "https://www.trumpf.com/en_US/products/machines-systems/2d-laser-cutting-machines/trulaser-3030-fiber-3040-fiber-3060-fiber-3080-fiber/",
      "accessed": "2026-10-08",
      "note": "페이지를 직접 열어 읽음. 치수에 팔레트 체인저가 포함되는지는 페이지에 없음."
    },
    {
      "id": "trumpf_trubend",
      "title": "TRUMPF TruBend Series 5000 — technical data table (5130)",
      "url": "https://www.trumpf.com/en_IN/products/machines-systems/bending-machines/trubend-series-5000/",
      "accessed": "2026-10-08",
      "note": "페이지를 직접 열어 읽음."
    },
    {
      "id": "arku_eb1000",
      "title": "ARKU EdgeBreaker 1000 — product page, technical data",
      "url": "https://arku.com/en/deburring-machines/laser-cut-and-punched-parts/edgebreaker-1000",
      "accessed": "2026-10-08",
      "note": "페이지를 직접 열어 읽음. 치수는 'approx.'로 표기됨. 이송 속도·소비전력은 페이지에 없음."
    },
    {
      "id": "zeiss_scanbox5",
      "title": "ZEISS ScanBox Series 5 — technical information table (5110/5120/5130)",
      "url": "https://www.zeiss.com/metrology/us/systems/optical-3d/automated-solutions/scanbox/zeiss-scanbox-series-5.html",
      "accessed": "2026-10-08",
      "note": "페이지를 직접 열어 읽음. 1회 측정 사이클 타임은 공개되지 않음."
    },
    {
      "id": "ksn_400wrd",
      "title": "KSN Industri 400 WRD conveyor washer — dealer listing (Exapro)",
      "url": "https://www.exapro.com/ksn-industri-as-400-wrd-p260918049",
      "accessed": "2026-10-08",
      "note": "딜러 리스팅. 제조사 데이터시트는 못 찾음. 판매자도 수치가 참고용이라고 명시."
    },
    {
      "id": "robodk_2600id",
      "title": "ABB IRB 2600ID-15/1.85 — RoboDK robot library (payload, reach, weight)",
      "url": "https://robodk.com/robot/ABB/IRB-2600ID-15-1-85",
      "accessed": "2026-10-08",
      "note": "집계 사이트를 직접 읽음(15 kg / 1850 mm / 276 kg). ABB 공식 페이지는 열리지 않음."
    },
    {
      "id": "abb_2600id_cn",
      "title": "ABB IRB 2600ID datasheet (Chinese) — base width 511 mm",
      "url": "https://library.e.abb.com/public/af25dc3727b947a7a1179eaa49001df3/IRB_2600ID_Datasheet_CN_RevA.pdf",
      "accessed": "2026-10-08",
      "note": "검색 요약을 거친 값. PDF 원문은 접근 거부(403)로 못 읽음."
    },
    {
      "id": "abb_2600id_ds_us",
      "title": "ABB IRB 2600ID datasheet (US Letter, 06.2017) — axis ranges and speeds, base 676 x 511 mm, weight",
      "url": "https://library.e.abb.com/public/c09d70e2b2f040eeb063dfa8a5ebc051/IRB%202600ID_Datasheet_US%20Letter.pdf",
      "accessed": "2026-10-13",
      "note": "PDF 본문을 읽음(공식 원문). 15/1.85 도면의 치수 라벨은 숫자만 있고 항목 대응이 없음. 팔 마디 길이는 데이터시트에 없음."
    },
    {
      "id": "lincoln_r450",
      "title": "Lincoln Electric Power Wave R450 — reseller page (dimensions, weight)",
      "url": "https://www.robots.com/accessories/lincoln-electric-power-wave-r450-robotic-power-source",
      "accessed": "2026-10-08",
      "note": "검색 요약 경유(571×355×630 mm, 68 kg). 원문 페이지는 접근 거부(403)."
    },
    {
      "id": "smc_hrs090",
      "title": "SMC HRS090 — cooling capacity 9.0 kW air-cooled / 10.5 kW water-cooled; pump, tank built in",
      "url": "https://elasticsearch.smcpneumatics.com/HRS090-A-20-M.html",
      "accessed": "2026-10-08",
      "note": "검색 요약 경유. 해당 모델은 SMC가 구형(legacy)으로 표시."
    },
    {
      "id": "rs_hrs090",
      "title": "RS datasheet — SMC HRS090-WF-40 (970 x 377 x 1090 mm)",
      "url": "https://docs.rs-online.com/0dc9/A700000014417377.pdf",
      "accessed": "2026-10-08",
      "note": "검색 요약 경유. PDF는 바이너리라 텍스트를 못 읽음. 수냉식 변형의 값."
    },
    {
      "id": "waterloo",
      "title": "UWaterloo engineering case — Tier 2 supplier, cargo-floor brackets (2 automated welders + press, >=80,000 parts/yr)",
      "url": "https://uwaterloo.ca/engineering-cases/node/272",
      "accessed": "2026-10-08"
    },
    {
      "id": "abb_flexarc",
      "title": "ABB FlexArc — robotic arc welding cell (robot, controller, power source, positioner, torch cleaning, fume hood)",
      "url": "https://one.robotics.abb.com/Solutions/p/FlexArc_L",
      "accessed": "2026-10-08"
    },
    {
      "id": "lincoln_cell",
      "title": "Lincoln Electric — robotic welding system (power source, wire drive, gas delivery, torch maintenance)",
      "url": "https://ch-delivery.lincolnelectric.com/api/public/content/bd60b6a57bf74268b82b3ce1577eeb7b",
      "accessed": "2026-10-08"
    },
    {
      "id": "smc_chiller",
      "title": "SMC — chiller for arc welding (water-cooled torch loop)",
      "url": "https://www.smcworld.com/products/solutions/en-jp/chiller2",
      "accessed": "2026-10-08"
    },
    {
      "id": "us7381924",
      "title": "US7381924 — adaptively cool a welding-type system (coolant circulated through the torch)",
      "url": "https://patents.google.com/patent/US7381924",
      "accessed": "2026-10-08"
    },
    {
      "id": "us6935550",
      "title": "US6935550 — robotic positioner with supply and take-away conveyors",
      "url": "https://image-ppubs.uspto.gov/dirsearch-public/print/downloadPdf/6935550",
      "accessed": "2026-10-08"
    },
    {
      "id": "trench_patent",
      "title": "US7975436 — utility trench cover (load-rated covers; pipes and conduit in trenches)",
      "url": "https://patents.google.com/patent/US7975436",
      "accessed": "2026-10-08"
    },
    {
      "id": "fume_guide",
      "title": "OHS Online — welding fume collection considerations (source capture, ducting)",
      "url": "https://ohsonline.com/articles/2024/03/01/breathing-easy-top-10-welding-fume-collection-considerations.aspx?Page=5",
      "accessed": "2026-10-08"
    },
    {
      "id": "demo_data",
      "title": "frontend/web-admin/src/data/demo.ts — demo equipment, cooling line, power zone, sensor baselines",
      "url": "file://frontend/web-admin/src/data/demo.ts",
      "accessed": "2026-10-08"
    },
    {
      "id": "trumpf_trumark",
      "title": "TRUMPF TruMark Station 5000 — product page, technical data",
      "url": "https://www.trumpf.com/en_IN/products/machines-systems/marking-systems/trumark-station-5000/",
      "accessed": "2026-10-08",
      "note": "페이지를 직접 열어 읽음. 마킹 속도는 없고 축 이동 속도만 공개."
    },
    {
      "id": "tregaskiss_tt4",
      "title": "Tregaskiss TT4 reamer / nozzle cleaning station — spec sheet",
      "url": "https://www.bernardtregaskiss.com/wp-content/uploads/2021/08/sp-tt4_2.0.pdf",
      "accessed": "2026-10-08",
      "note": "검색 요약 경유(349 × 263 × 563 mm, 기본 유닛). PDF는 열리지 않음(404)."
    },
    {
      "id": "mir250",
      "title": "MiR250 product specifications (reseller-hosted PDF)",
      "url": "https://www.hartfiel.com/wp-content/uploads/2024/04/MiR250-Specs.pdf",
      "accessed": "2026-10-08",
      "note": "검색 요약 경유(800 × 580 × 300 mm, 2025 사양). PDF는 바이너리라 텍스트를 못 읽음."
    },
    {
      "id": "epal_pallet",
      "title": "EUR/EPAL pallet standard size 1200 x 800 x 144 mm (multiple guides)",
      "url": "https://www.icontainers.com/help/euro-pallet-epal-sizes-specifications",
      "accessed": "2026-10-08",
      "note": "여러 안내 자료가 일치하는 표준 규격."
    },
    {
      "id": "abb_positioners",
      "title": "ABB positioner brochure — IRBP A: 250/500/750 kg payload options",
      "url": "https://library.e.abb.com/public/7d461dacc632ca98c125734b0035ebf6/ABB%20Positioners.pdf",
      "accessed": "2026-10-08",
      "note": "치수 도면은 접근하지 못함."
    }
  ],
  "catalog": {
    "raw_rack": {
      "name_ko": "자재 랙",
      "category": "storage",
      "footprint_m": {
        "w": 3.6,
        "d": 2.4,
        "h": 1.6
      },
      "spec_notes": [
        "EUR/EPAL 팔레트 1200 × 800 × 144 mm"
      ],
      "provenance": {
        "footprint_m": {
          "confidence": "assumed",
          "source_ids": [
            "epal_pallet"
          ],
          "note": "EUR 팔레트 1200×800 mm의 3×3 배열(9장)로 가정. 팔레트 규격은 표준이나 배열은 가정."
        }
      }
    },
    "stock": {
      "name_ko": "적치 구역",
      "category": "storage",
      "footprint_m": {
        "w": 2.4,
        "d": 1.6,
        "h": 1.2
      },
      "spec_notes": [
        "EUR/EPAL 팔레트 1200 × 800 × 144 mm"
      ],
      "provenance": {
        "footprint_m": {
          "confidence": "assumed",
          "source_ids": [
            "epal_pallet"
          ],
          "note": "EUR 팔레트 1200×800 mm의 2×2 배열(4장)로 가정."
        }
      }
    },
    "laser_cutter": {
      "name_ko": "레이저 절단기",
      "category": "process",